,Document Title,Abstract
212,Towards Formal Monitoring of Workpieces in Agile Manufacturing,"Information about the locations of objects is one of the main ingredients of Industry 4.0. With the increased use of flexible and agile manufacturing techniques, the monitoring of workpieces in a factory can become more challenging. In this paper, we present a state-machine-based approach for monitoring workpieces using sensors such as RFID readers. We present a solution where each object is represented as a deterministic state machine to monitor the object's journey throughout production via this state machine representation. Multiple objects can be monitored at the same time by running parallel event-based state machines. We present an implementation of our solution using RFID-Readers and OPC UA."
219,Workshop Management and Control System Based on Digital Twin,"Aiming at the connotation and characteristics of digital twin, and improving the level of informatization and intelligence of the workshop, a workshop management and control system based on digital twins is proposed, which can realize the management and control of the full life cycle of digital twins. Based on the physical production line model of the digital twin, the virtual and real joint debugging method of the digital twin workshop is constructed: the controller controls the virtual model, and the virtual model drives the simulation. The operation and control model of the digital twin is driven through the communication framework of OPC UA (Object Linking and Embedding for Process Unified Architecture), and the virtual and real interaction of the physical production line is used to timely reflect the operation of the workshop. From model building, model digital drive, virtual and real control joint debugging, to full life cycle workshop verification and design simulation, the visual monitoring of the digital twin workshop is finally realized."
222,Design and Application of Cloud Platform Based on OpenStack in Remote Online Collection and Monitoring System of Intelligent Workshop,"With the development of information technology, network technology, Internet technology, cloud computing technology and so on are more and more widely used in various industries. The traditional industrial automation hierarchy structure is complex and the integration degree is not high. It can not meet the development needs of informationization and intelligence, and is limited by the site infrastructure. Therefore, this paper designs a remote online acquisition and monitoring system architecture for intelligent workshop based on OpenStack private cloud computing, which completes the functions of data acquisition, online monitoring, database management and real-time control. In addition, this paper also considers the characteristics of the system architecture, such as filing, disaster tolerance and security. Using OPC UA protocol and Modbus RTU protocol to complete data acquisition, data interaction between the bottom of the factory and the bottom of the enterprise. At the same time, cloud computing data center centralized storage and management of the collected data, which provides great convenience for the follow-up analysis of large data in the workshop, and has a certain practical value."
223,Analyzing Manufacturing Data in a Digital Control Room Making Use of Semantic Annotations,"The German manufacturing industry carries out new developments towards Industry 4.0, which focus on smart factories and smart assistance systems. In this paper, we present our digital control room for analyzing manufacturing data aiming at optimizing production processes. It builds upon our digital boardroom - a multi-display environment integrating multitouch and multiuser-based annotation dashboards so that decision makers gain insights into and can discuss an organization's data. In particular, our digital control room integrates the OPC UA protocol, semantic annotations, and a time series database to analyze, visualize and interact with machine data. Thereby, it can combine real time, near-real time, and batch processing of machine data and constitutes a holistic business intelligence environment."
224,"SCADA System Framework for Monitoring, Controlling and Data Logging of Industrial Processing Plants","In this research, an advancement of an open source administrative control and information obtaining Supervisory Control and Data Acquisition Systems (SCADA) framework is presented. The framework utilizes the universally useful programming platform, Python. The SCADA framework offers correspondence capacities through an open source OPC-UA worker, which comprehends information trade with control gadgets, for example, PLC, PAC, and so on. The framework additionally gives adaptation to non-critical failure highlights because of the execution of a functioning shortcoming open minded control (AFTC) engineering. The proposed approach plays out a three-layer connection of the CIM model, and offers comparable capacities of business SCADA frameworks."
235,Development of a Power Supply Control System and Virtual Simulation Based on Docker,"A proton therapy facility (HUST-PTF) based on a superconducting cyclotron is being developed by Huazhong University of Science and Technology (HUST) and China Academy of Atomic Energy (CIAE). The beam transport system in this facility provides the required beam for the treatment rooms. The beamline control system (BCS) manages the operation of the degrader, beamline magnet power supplies (PS), diagnostics devices, etc. For additional security, BCS utilizes the OPC UA as the distributed control protocol. Since the PS controllers adopt a TCP communication protocol, an OPC UA server with TCP driver is developed as a gateway and front controller for PS control. In order to adapt fast beam-energy change, the ""list-trigger"" strategy is applied to the PS control. BCS downloads the respective current value lists to PS controllers before the treatment, and then triggers the PS controllers by pulse signals to alter the operation current to the next value in the list during the treatment. It is vital to decide when the current regulation process is complete in the transitional period, BCS should update the current values more frequent than the steady state. Therefore, the OPC UA server adopts the node dynamic refresh scheme. A virtual simulation based on docker followed by a thorough analysis are conducted on the PS control system, where the results show the node refresh time of the OPC UA server meets the PS control requirement. The virtual simulation is also proved to be cost-saving and reliable for control system tests and worth promoting."
239,"Supporting the Design, Commissioning and Supervision of Smart Factory Components through their Digital Twin","In a context of greater complexity of Smart Factories, the commissioning time for automated systems needs to be shortened. The use of virtual commissioning tools is a good contribution to achieve this goal. Ideally, those tools should be part of a virtual engineering environment sharing same virtual model, the digital twin, through the complete lifecycle of the automated system, namely the project, simulation, implementation and execution/monitoring/supervision and, eventually decommissioning phases. Such vision includes a digital twin with a broader use, which is consistent with the real system and one that can be used after the early design and commissioning phases. Finding a complete set of tools able to comply with the above requirements can be extremely challenging. In this paper we explore the use of the ABB RobotStudio software combined with the OPC UA standard with this vision in mind. Methodologies were defined to integrate both new generation and legacy equipment, as well as robot controllers and guidelines for equipment development. A key result of this work is the development of a set of virtual engineering tools and methodologies based on OPC UA and implemented using RobotStudio in order to accomplish the complete lifecycle support of an automated system, from the project and simulation phases, to the monitoring and supervision phases, suitable for integration in Industry 4.0 factories. Results are described for a test scenario with different devices."
246,Digitizing a Distributed Textile Production Process using Industrial Internet of Things: A Use-Case,"Many textile production chains are highly fragmented and distributed over several locations and countries. Textile machinery usually relies on proprietary software and hardware that cannot be sufficiently interlinked. As a result, machine and product data is not comprehensively collected and analyzed across the whole production process. Thus, the potential of Smart Manufacturing and Industry 4.0 is often not fully exploited in the textile industry. In recent years, vendor-independent machine to machine communication protocols and standards, such as OPC UA and MQTT have been suggested for the digitization of production facilities by integrating or replacing these proprietary systems. In contrast, there is still a lack of publicly available working demonstrations and exemplary implementations in the textile context. In this paper, we use Industrial Internet of Things technologies to design an open digital infrastructure for textile manufacturing. We develop our approach based on a production use-case that is distributed across multiple locations. By machine networking and integrating information flows from the shop floor to the cloud, we lay the basis for getting most value out of process-wide collected data. Our suggested infrastructure supports the use of Machine Learning techniques to enable various Smart Manufacturing applications, such as Predictive Maintenance and Predictive Quality."
253,Dynamic Control Model Based on State Perception,"The monitoring system built on the OPC UA (object linking and embedding (OLE) for process control unified architecture) protocol cannot detect the congestion of each terminal network and the load pressure of the cluster server nodes in real time. In the case that the number of terminal accesses is increasing and the traffic volume is gradually increasing, some server nodes of the system are overloaded or crash. In response to these questions, this paper presents a dynamic control model based on state perception. This model can perceive the communication state of client and server in real time, and uses the current resource occupancy index of the server and the network congestion indicators of each client as the adjustment conditions. The model algorithm can dynamically adjust the client served by the overload node to the server node with small load. Meanwhile, the model uses the congestion estimation method based on bandwidth estimation to accurately estimate the network conditions of each client and improve the validity of state-aware information. The simulation results show that the model can sense the load of each server and make reasonable adjustments to achieve a good load balancing effect. At the same time, the experiment verifies the feasibility and efficiency of the model."
260,An Approach for Data Pipeline with Distributed Query Engine for Industrial Applications,"The data driven services in industrial automation systems are transforming the world of automation industry by optimizing industrial processes and providing Value Added Services (VASs) with the grace of Industry 4.0, Big Data and Artificial Intelligence (AI). A demand driven data pipeline is essential to connect different industrial data sources in a shop floor with different data storage systems for service provisioning. This paper analyzes an experimental approach and corresponding challenges to optimize computing resource allocation in industrial applications to construct such demand driven data pipeline to provide data driven services through an open source, flexible and extensible distributed query engine known as Presto, which can perform interactive analytical queries for different purposes such as condition monitoring, asset management or many others."
266,Monitoring of Discrete Electrical Signals from Welding Processes using Data Mining and IIoT Approaches,"Processes such as welding involve consumption of huge amounts of energy leading to generation of significant electrical data consisting of current and voltage signals. The added task is to inspect the quality of welding using such data as early as possible to identify defects in producing welded parts or equipment. From the perspective of machine learning, this paper presents a data mining approach to analyse small sampled amounts of electrical signals to identify welding inconsistencies using conventional methods such as clustering algorithms, time-series and multi-label classifiers. Using unlabelled and discrete signals, an attempt is made to build a process profile on the welding robots with the use of comparison measures such as Jaccard's metric. To monitor such a mechanism, a simulation application based on IIoT standard Open Platform Communication (OPC UA) is developed to present the analysis over secure network servers to clients. The application setup presents a basic monitoring system for welding processes using available technologies like machine learning algorithms and OPC UA."
273,A Cost-Efficient and Continuous Ethernet Cable Diagnosis Technique based on Undersampling,"The monitoring of industrial environments ensures that highly automated processes run without interruption. However, even if the industrial machines themselves are monitored, the communication lines are currently not continuously monitored in todays installations. They are checked usually only during maintenance intervals or in case of error. In addition, the cables or connected machines usually have to be removed from the system for the duration of the test. To overcome these drawbacks, we have developed and implemented a cost-efficient and continuous signal monitoring of Ethernet-based industrial bus systems. Several methods have been developed to assess the quality of the cable. These methods can be classified to either passive or active. Active methods are not suitable if interruption of the communication is undesired. Passive methods, on the other hand, require oversampling, which calls for expensive hardware. In this paper, a novel passive method combined with undersampling targeting cost-efficient hardware is proposed."
